{
  "id": "00000000-0000-4000-8000-000000000006",
  "schema_version": "1.0.0",
  "revision": 0,
  "status": "generated",
  "projectId": "00000000-0000-4000-8000-000000000001",
  "assetId": "00000000-0000-4000-8000-000000000005",
  "versionNumber": 1,
  "contentHash": "aaaaaaaaaaaaaaaaaaaaaaaaaaaaaaaaaaaaaaaaaaaaaaaaaaaaaaaaaaaaaaaa",
  "storageObject": {
    "storageProvider": "local-workspace",
    "bucket": "development",
    "objectKey": "projects/00000000-0000-4000-8000-000000000001/assets/00000000-0000-4000-8000-000000000005/00000000-0000-4000-8000-000000000006/original.mp4",
    "mimeType": "video/mp4",
    "sizeBytes": 1024,
    "checksum": "aaaaaaaaaaaaaaaaaaaaaaaaaaaaaaaaaaaaaaaaaaaaaaaaaaaaaaaaaaaaaaaa"
  }
}
